{
  "schema_version": 2,
  "reviewer_role": "EXTERNAL_COMPATIBILITY_REVIEWER",
  "review_generation": "R2",
  "source_thread_id": "019f890d-514f-7811-a38d-00b9daa91f1c",
  "review_package_id": "MAGP-SSR2-COMPATIBILITY-4AC2104F-C7CC-499A-9C08-678F89B0D409",
  "reviewer_run_id": "RUN-114A3F2C-4C6C-4F5B-A438-23693E7C5C1B",
  "payload_sha256": "B4C186FDABE327136D338FBBE60B653B4E3256E887C03B88B097818727252E71",
  "payload_modified": false,
  "transported_by_human": true,
  "payload_schema_id": "urn:magp:startup-failure-evidence-admission:v2",
  "payload_schema_sha256": "DB5E6C8265FBB7364208BD818182675365C1D20E9C4AF0ECFE92959939B78A29",
  "payload_validation_branch": "STARTUP_BLOCKER_FAILURE_EVIDENCE",
  "payload_admission_class": "ADMITTED_STARTUP_FAILURE_EVIDENCE",
  "substantive_review_credit": "NONE",
  "aggregator_eligible": false,
  "source_raw_artifact_path": "C:/Users/a2306/Desktop/code/ntmc.yaml/輕軌系統/.codex/tasks/GOV-MAGP-COMPATIBILITY-R2-STARTUP-BLOCKER-INTAKE-AND-RETRY-PREPARATION-01/compatibility-r2-attempt-1/raw-wrapper.txt",
  "source_raw_artifact_sha256": "B4C186FDABE327136D338FBBE60B653B4E3256E887C03B88B097818727252E71"
}
